Status,title,authors,isbn,publisher
in,Harry Potter and the Half-Blood Prince (Harry Potter  #6),J.K. Rowling/Mary GrandPré,439785960,Scholastic Inc.
in,Harry Potter and the Order of the Phoenix (Harry Potter  #5),J.K. Rowling/Mary GrandPré,439358078,Scholastic Inc.
in,Harry Potter and the Chamber of Secrets (Harry Potter  #2),J.K. Rowling,439554896,Scholastic
in,Harry Potter and the Prisoner of Azkaban (Harry Potter  #3),J.K. Rowling/Mary GrandPré,043965548X,Scholastic Inc.
in,Harry Potter Boxed Set  Books 1-5 (Harry Potter  #1-5),J.K. Rowling/Mary GrandPré,439682584,Scholastic
in,"Unauthorized Harry Potter Book Seven News: ""Half-Blood Prince"" Analysis and Speculation",W. Frederick Zimmerman,976540606,Nimble Books
in,Harry Potter Collection (Harry Potter  #1-6),J.K. Rowling,439827604,Scholastic
in,The Ultimate Hitchhiker's Guide: Five Complete Novels and One Story (Hitchhiker's Guide to the Galaxy  #1-5),Douglas Adams,517226952,Gramercy Books
in,The Ultimate Hitchhiker's Guide to the Galaxy (Hitchhiker's Guide to the Galaxy  #1-5),Douglas Adams,345453743,Del Rey Books
in,The Hitchhiker's Guide to the Galaxy (Hitchhiker's Guide to the Galaxy  #1),Douglas Adams,1400052920,Crown
in,The Hitchhiker's Guide to the Galaxy (Hitchhiker's Guide to the Galaxy  #1),Douglas Adams/Stephen Fry,739322206,Random House Audio
in,The Ultimate Hitchhiker's Guide (Hitchhiker's Guide to the Galaxy  #1-5),Douglas Adams,517149257,Wings Books
in,A Short History of Nearly Everything,Bill Bryson,076790818X,Broadway Books
out,Bill Bryson's African Diary,Bill Bryson,767915062,Broadway Books
in,Bryson's Dictionary of Troublesome Words: A Writer's Guide to Getting It Right,Bill Bryson,767910435,Broadway Books
in,In a Sunburned Country,Bill Bryson,767903862,Broadway Books
in,I'm a Stranger Here Myself: Notes on Returning to America After Twenty Years Away,Bill Bryson,076790382X,Broadway Books
in,The Lost Continent: Travels in Small Town America,Bill Bryson,60920084,William Morrow Paperbacks
in,Neither Here nor There: Travels in Europe,Bill Bryson,380713802,William Morrow Paperbacks
in,Notes from a Small Island,Bill Bryson,380727501,William Morrow Paperbacks
in,The Mother Tongue: English and How It Got That Way,Bill Bryson,380715430,William Morrow Paperbacks
in,J.R.R. Tolkien 4-Book Boxed Set: The Hobbit and The Lord of the Rings,J.R.R. Tolkien,345538374,Ballantine Books
in,The Lord of the Rings (The Lord of the Rings  #1-3),J.R.R. Tolkien,618517650,Houghton Mifflin Harcourt
in,The Fellowship of the Ring (The Lord of the Rings  #1),J.R.R. Tolkien,618346252,Houghton Mifflin Harcourt
in,The Lord of the Rings (The Lord of the Rings  #1-3),J.R.R. Tolkien/Alan  Lee,618260587,Houghton Mifflin Harcourt
in,The Lord of the Rings: Weapons and Warfare,Chris   Smith/Christopher  Lee/Richard Taylor,618391002,Houghton Mifflin Harcourt
in,The Lord of the Rings: Complete Visual Companion,Jude Fisher,618510826,Houghton Mifflin Harcourt
in,Agile Web Development with Rails: A Pragmatic Guide,Dave Thomas/David Heinemeier Hansson/Leon Breedt/Mike Clark/Thomas  Fuchs/Andreas  Schwarz,097669400X,Pragmatic Bookshelf
in,Hatchet (Brian's Saga  #1),Gary Paulsen,689840926,Atheneum Books for Young Readers: Richard Jackson Books
in,"Hatchet: A Guide for Using ""Hatchet"" in the Classroom",Donna Ickes/Edward Sciranko/Keith Vasconcelles,1557344493,Teacher Created Resources
in,Guts: The True Stories behind Hatchet and the Brian Books,Gary Paulsen,385326505,Delacorte Press
in,Molly Hatchet - 5 of the Best,Molly Hatchet,1575606240,Cherry Lane Music Company
in,Hatchet Jobs: Writings on Contemporary Fiction,Dale Peck,1595580271,The New Press
in,A Changeling for All Seasons (Changeling Seasons #1),Angela Knight/Sahara Kelly/Judy Mays/Marteeka Karland/Kate Douglas/Shelby Morgen/Lacey Savage/Kate Hill/Willa Okati,1595962808,Changeling Press
in,Changeling (Changeling  #1),Delia Sherman,670059676,Viking Juvenile
out,The Changeling Sea,Patricia A. McKillip,141312629,Firebird
in,The Changeling,Zilpha Keatley Snyder,595321801,iUniverse
out,The Changeling,Kate Horsley,1590301943,Shambhala
in,The Changeling (Daughters of England  #15),Philippa Carr,449146979,Ivy Books
in,The Known World,Edward P. Jones,61159174,Amistad
in,The Known World,Edward P. Jones/Kevin R. Free,006076273X,HarperAudio
in,The Known World,Edward P. Jones,60749911,Harper
in,Traders  Guns & Money: Knowns and Unknowns in the Dazzling World of Derivatives,Satyajit Das,273704745,FT Press
in,Artesia: Adventures in the Known World,Mark Smylie,1932386106,Archaia
in,The John McPhee Reader (John McPhee Reader  #1),John McPhee/William Howarth,374517193,Farrar  Straus and Giroux
in,Uncommon Carriers,John McPhee,374280398,Farrar Straus Giroux
in,Heirs of General Practice,John McPhee,374519749,Farrar  Straus and Giroux
in,The Control of Nature,John McPhee,374522596,Farrar  Straus and Giroux
in,Annals of the Former World,John McPhee,374518734,Farrar  Straus and Giroux
in,Coming Into the Country,John McPhee,374522871,Farrar  Straus and Giroux
in,La Place de la Concorde Suisse,John McPhee,374519323,Farrar  Straus and Giroux
in,Giving Good Weight,John McPhee,374516006,Farrar  Straus and Giroux
in,Rising from the Plains,John McPhee,374520658,Farrar  Straus and Giroux
in,The Heidi Chronicles,Wendy Wasserstein,822205106,Dramatists Play Service
in,The Heidi Chronicles: Uncommon Women and Others & Isn't It Romantic,Wendy Wasserstein,679734996,Vintage
in,Active Literacy Across the Curriculum: Strategies for Reading  Writing  Speaking  and Listening,Heidi Hayes Jacobs,1596670231,Routledge
in,Simply Beautiful Beaded Jewelry,Heidi Boyd,1581807740,North Light Books
in,Always Enough: God's Miraculous Provision Among the Poorest Children on Earth,Heidi Baker/Rolland Baker,800793617,Chosen Books
in,Mapping the Big Picture: Integrating Curriculum & Assessment K-12,Heidi Hayes Jacobs,871202867,Association for Supervision & Curriculum Development
in,Heidi (Heidi  #1-2),Johanna Spyri/Beverly Cleary/Angelo  Rinaldi,753454947,Kingfisher
out,Getting Results with Curriculum Mapping,Heidi Hayes Jacobs,871209993,ASCD
in,There's Always Enough: The Miraculous Move of God in Mozambique,Rolland Baker/Heidi Baker,1852402873,Sovereign World
in,The Player's Handbook: The Ultimate Guide on Dating and Relationships,Heidi Fleiss/Libby Keatinge,972016414,One Hour Entertainment
in,Simply Beautiful Beading: 53 Quick and Easy Projects,Heidi Boyd,1581805632,North Light Books
in,What to Expect the First Year (What to Expect),Heidi Murkoff/Sharon Mazel/Arlene Eisenberg/Sandee Hathaway/Mark D. Widome,761129588,Workman Publishing Company
